{
  "id": "feat-20260916-offline-notes-sync",
  "version": 1,
  "timestamp": "2026-09-16T11:05:00Z",
  "sourceProject": "nimo-web",
  "category": "platform_capability",
  "status": "processed",
  "title": "Offline Study Notes Synchronization",
  "summary": "Allow students to take notes during network interruptions and sync reliably when connectivity resumes.",
  "useCase": "Students studying in environments with intermittent WiFi (transit, rural zones) frequently lose unsaved notes or experience sync lockouts.",
  "expectedBenefit": "Zero data loss for learners and increased engagement during offline study sessions.",
  "priority": "high",
  "feasibility": "moderate",
  "evidence": [
    "feedback:fbk-20260916-offline-need-33",
    "survey:student-study-habits-q3"
  ],
  "metadata": {
    "sanitized": true,
    "tags": [
      "offline",
      "sync",
      "indexeddb",
      "student-experience"
    ],
    "targetMilestone": "v2.2-release"
  }
}
